review,review_clean,review_processed,rating,sentiment,date,userName
saya sangan sangat kecewa dengan pubg 7 tahun saya main.akun saya tidak pernah bermasalah.giliran di retas gak ada solusi.aju banding gak jelas.data yang kita masukin benar semua.malah gak ada solusi.saya malas ngulang hal yang sama dari nol.terpaksa saya harus memaksakan diri untuk pensi dan delete pubg.apa yang saya harapkan lagi.login fb udah di hapus.login email udah gak bisa juga udah di ganti sandi.mau hubungin pubg yang di minta email itu juga yang tertaut di game.sama aja kong x kong.,saya sangan sangat kecewa dengan pubg tahun saya mainakun saya tidak pernah bermasalahgiliran di retas gak ada solusiaju banding gak jelasdata yang kita masukin benar semuamalah gak ada solusisaya malas ngulang hal yang sama dari nolterpaksa saya harus memaksakan diri untuk pensi dan delete pubgapa yang saya harapkan lagilogin fb udah di hapuslogin email udah gak bisa juga udah di ganti sandimau hubungin pubg yang di minta email itu juga yang tertaut di gamesama aja kong x kong,sangan kecewa pubg mainakun bermasalahgiliran retas solusiaju banding jelasdata masukin semuamalah solusisaya malas ngulang nolterpaksa memaksakan pensi delete pubgapa harapkan lagilogin fb hapuslogin email ganti sandimau hubungin pubg email tertaut gamesama kong kong,1,negatif,2025-11-02 14:22:19,Ji burrahman
"ini game favorit saya, cuman 1 yang bikin jengkel. drop pink padahal sinyal bagus. padahal saya main game ini dri 2019 sampei sekrang masih aktif trus.",ini game favorit saya cuman yang bikin jengkel drop pink padahal sinyal bagus padahal saya main game ini dri sampei sekrang masih aktif trus,game favorit cuman bikin jengkel drop pink sinyal bagus main game dri sampei sekrang aktif trus,2,negatif,2025-11-02 13:01:26,Kepic Baek
gk seru main pubg udh masuk ke permainan eh malah balik lagi aku ksh bintang 1 aja deh kalo nnti aku ksh 5 aku nyesel main pubg jelek pubg,gk seru main pubg udh masuk ke permainan eh malah balik lagi aku ksh bintang aja deh kalo nnti aku ksh aku nyesel main pubg jelek pubg,seru main pubg masuk permainan ksh bintang nnti ksh nyesel main pubg jelek pubg,1,negatif,2025-11-02 12:18:28,Maar RiyaM
"sengaja aku kasih bintang 5 biar di baca kenapa PUBG ini sering banget update, dikit² update.. makan memori bnyak banget, baru sebulan lalu aq update sekarang sudah ada pemberitahuan untuk update versi terbaru lagi.. dari awal PUBG rilis, sering banget pembaharuan tp memberantas bug dan chet ga bisa.",sengaja aku kasih bintang biar di baca kenapa pubg ini sering banget update dikit update makan memori bnyak banget baru sebulan lalu aq update sekarang sudah ada pemberitahuan untuk update versi terbaru lagi dari awal pubg rilis sering banget pembaharuan tp memberantas bug dan chet ga bisa,sengaja kasih bintang biar baca pubg update dikit update makan memori bnyak sebulan aq update pemberitahuan update versi terbaru pubg rilis pembaharuan memberantas bug chet,5,positif,2025-11-02 11:44:30,Big Boss
saya pindah game karma akun gw hilang,saya pindah game karma akun gw hilang,pindah game karma akun hilang,2,negatif,2025-11-02 10:21:23,Asril Sanusi
mau main game aja mesti setting sensitivitas yang pas dulu... makin kesini makin ribet,mau main game aja mesti setting sensitivitas yang pas dulu makin kesini makin ribet,main game mesti setting sensitivitas pas kesini ribet,1,negatif,2025-11-02 09:59:55,Doli indraji Hushna
oke gas,oke gas,oke gas,5,positif,2025-11-02 09:49:05,Imranputraboul Imran
enak baget,enak baget,enak baget,5,positif,2025-11-02 09:39:09,Lola Rodrigues
pubg mobile burik bukan mau perang mau bertamu,pubg mobile burik bukan mau perang mau bertamu,pubg mobile burik perang bertamu,1,negatif,2025-11-02 09:23:40,Arif
"teammatch tidak seimbang, main Ace dominator selalu dipasangkan Ama rank diamond atau crown.. sistem payah",teammatch tidak seimbang main ace dominator selalu dipasangkan ama rank diamond atau crown sistem payah,teammatch seimbang main ace dominator dipasangkan ama rank diamond crown sistem payah,1,negatif,2025-11-02 07:52:03,Hitam
tolong lah perbaiki ni pubg enggak tau kenapa jadi enggak bisa login katanya harus apdet tapi tidak ada anpdetan jadi tolong lah ya perbaiki,tolong lah perbaiki ni pubg enggak tau kenapa jadi enggak bisa login katanya harus apdet tapi tidak ada anpdetan jadi tolong lah ya perbaiki,tolong perbaiki ni pubg login apdet anpdetan tolong perbaiki,5,positif,2025-11-02 07:45:06,rapi
NyandU Beut Pokoknya mah,nyandu beut pokoknya mah,nyandu beut pokoknya mah,5,positif,2025-11-02 07:28:37,nunu _nun9
"Serba jelek, tidak bermutu",serba jelek tidak bermutu,serba jelek bermutu,1,negatif,2025-11-02 07:25:24,i ketut agus widiana
tidak bisa login,tidak bisa login,login,1,negatif,2025-11-02 06:53:36,Dika Ardiansyah 0710
"nyari macth nya sekarang lama bangets bisa sampai 10 menit, kalau kayak gini jadinya ngebosenin, player niat mau main tapi nunggu lama bahkan udah ganti berbagai map tetep aja lama nemuin macth nya, yang ada gak jadi main tapi kuota abis cuman buat loading doang",nyari macth nya sekarang lama bangets bisa sampai menit kalau kayak gini jadinya ngebosenin player niat mau main tapi nunggu lama bahkan udah ganti berbagai map tetep aja lama nemuin macth nya yang ada gak jadi main tapi kuota abis cuman buat loading doang,nyari macth bangets menit kayak gini ngebosenin player niat main nunggu ganti map tetep nemuin macth main kuota abis cuman loading doang,1,negatif,2025-11-02 06:05:37,Kristianto
game haram,game haram,game haram,1,negatif,2025-11-02 03:07:19,Surya Araya raya
game sangat bagus,game sangat bagus,game bagus,5,positif,2025-11-02 02:59:18,Muhammad Bisma
"Maaf saya mengeluhkan tentang data game yang mengunduh secara otomatis menggunakan data seluler / kouta padahal saya sudah menonaktifkannya, dan ini membuat data / Kouta saya cepat habis karena saya hanya ingin mengunduh data dalam game menggunakan wifi saja bukan data / kouta !!",maaf saya mengeluhkan tentang data game yang mengunduh secara otomatis menggunakan data seluler kouta padahal saya sudah menonaktifkannya dan ini membuat data kouta saya cepat habis karena saya hanya ingin mengunduh data dalam game menggunakan wifi saja bukan data kouta,maaf mengeluhkan data game mengunduh otomatis data seluler kouta menonaktifkannya data kouta cepat habis mengunduh data game wifi data kouta,3,netral,2025-11-01 23:24:44,Mohammad Fadel Paputungan
tolong developer gamenya jangan terlalu berat,tolong developer gamenya jangan terlalu berat,tolong developer gamenya berat,4,positif,2025-11-01 23:07:25,Samuel Marpaung
sekarang login pakai Facebook tidak bisa masuk dan memakai email Google juga tidak bisa 😡,sekarang login pakai facebook tidak bisa masuk dan memakai email google juga tidak bisa,login pakai facebook masuk memakai email google,1,negatif,2025-11-01 22:26:25,ᑕᕼIᗷI ᑕᒪOᗯᑎ
kenapa gak bisa buka game nya mohon info nya,kenapa gak bisa buka game nya mohon info nya,buka game mohon info,1,negatif,2025-11-01 22:14:56,Ari AZ
tolong pubg kecilin ukuran lagi dong biar hp dengan spesifikasi rendah tetap bisa bermain pubg tanpa gangguan tolong banget kami pecinta pubg dengan hp kualitas rendah juga ingin bermain pubg dengan lancar tanpa gangguan pasti pubg rame pemain lagi Kalo hp spesifikasi rendah bisa bermain dengan lancar,tolong pubg kecilin ukuran lagi dong biar hp dengan spesifikasi rendah tetap bisa bermain pubg tanpa gangguan tolong banget kami pecinta pubg dengan hp kualitas rendah juga ingin bermain pubg dengan lancar tanpa gangguan pasti pubg rame pemain lagi kalo hp spesifikasi rendah bisa bermain dengan lancar,tolong pubg kecilin ukuran biar hp spesifikasi rendah bermain pubg gangguan tolong pecinta pubg hp kualitas rendah bermain pubg lancar gangguan pubg rame pemain hp spesifikasi rendah bermain lancar,5,positif,2025-11-01 21:13:40,Ayo Bercocok tanam
please stop download,please stop download,please stop download,1,negatif,2025-11-01 20:34:42,acousticanbae
ping nya naik kalau ketemu musuh,ping nya naik kalau ketemu musuh,ping ketemu musuh,1,negatif,2025-11-01 20:03:00,OKTA GAMING
game bagus dari pada ff burik,game bagus dari pada ff burik,game bagus ff burik,5,positif,2025-11-01 19:19:59,Makaeling Her
"even after 7 years to get m4 glacier can't be done, this is really a scam in terms of gacha",even after years to get m glacier cant be done this is really a scam in terms of gacha,even after years to get glacier cant be done this is really scam in terms of gacha,1,negatif,2025-11-01 19:07:26,Laos Ijo
kacau nihhh...di saat krusial...malah di kasih leg...payahhh benerrrr...developer nya kacauuuu parahhhh...kecewa gw..payah bener nihhh....haduhhh kacau kacau....,kacau nihhhdi saat krusialmalah di kasih legpayahhh benerrrrdeveloper nya kacauuuu parahhhhkecewa gwpayah bener nihhhhaduhhh kacau kacau,kacau nihhhdi krusialmalah kasih legpayahhh benerrrrdeveloper kacauuuu parahhhhkecewa gwpayah bener nihhhhaduhhh kacau kacau,1,negatif,2025-11-01 18:54:57,Damai Ibrahim
season ghost yang sekarang buruk. terlalu banyak tombol dan kurang seru. payah pubg makin kesini ampas,season ghost yang sekarang buruk terlalu banyak tombol dan kurang seru payah pubg makin kesini ampas,season ghost buruk tombol seru payah pubg kesini ampas,1,negatif,2025-11-01 18:08:35,Salrya
haram geme ini mending hapus aja geme ini ayo pindan dari Geme ini mending ke mobile legend aja,haram geme ini mending hapus aja geme ini ayo pindan dari geme ini mending ke mobile legend aja,haram geme mending hapus geme ayo pindan geme mending mobile legend,1,negatif,2025-11-01 18:00:36,Nijar Saydan
"selama 7 tahun main cuman 1 kata buat PUBG mobile tolong safety cheater d tingkatkan kembali dan bug2 tolong di maximal arena rankednya,dan arena TDM tdk usah d pertemukan dgn bot auto aim,bikin kami itu nda semangat main,karna percuma kami upgrade senjata to musuhnya bot,kan bagus kalau ktmu dgn sama2 sultan atau sama2 player, makasih yaa pubg🙏 see you pubg.",selama tahun main cuman kata buat pubg mobile tolong safety cheater d tingkatkan kembali dan bug tolong di maximal arena rankednyadan arena tdm tdk usah d pertemukan dgn bot auto aimbikin kami itu nda semangat mainkarna percuma kami upgrade senjata to musuhnya botkan bagus kalau ktmu dgn sama sultan atau sama player makasih yaa pubg see you pubg,main cuman pubg mobile tolong safety cheater tingkatkan bug tolong maximal arena rankednyadan arena tdm tdk pertemukan bot auto aimbikin nda semangat mainkarna upgrade senjata to musuhnya botkan bagus ktmu sultan player makasih yaa pubg see you pubg,5,positif,2025-11-01 17:59:35,Rajamonster laut
karena game nya enak seru tapi kurang hd tolong hd kan PUBG YA Terima kasih untuk game nya enak kok,karena game nya enak seru tapi kurang hd tolong hd kan pubg ya terima kasih untuk game nya enak kok,game enak seru hd tolong hd pubg terima kasih game enak,5,positif,2025-11-01 16:55:29,Rara Rara
"kalau bisa untuk login ke dalam game, baik itu solo , duo dan squad jangan dipersulit. terimakasih",kalau bisa untuk login ke dalam game baik itu solo duo dan squad jangan dipersulit terimakasih,login game solo duo squad dipersulit terimakasih,5,positif,2025-11-01 16:25:16,Mangoeh Malam
"A lot of people in this game, using cheat, is not make me and the other excited again to play this game, how can you as the development do, to clean thats the cheater, i'm still waiting for the new update and fix so many bugs in this game, and i hope you can banned some player who can use cheat",a lot of people in this game using cheat is not make me and the other excited again to play this game how can you as the development do to clean thats the cheater im still waiting for the new update and fix so many bugs in this game and i hope you can banned some player who can use cheat,lot of people in this game using cheat is not make me and the other excited again to play this game how can you as the development do to clean thats the cheater im still waiting for the new update and fix so many bugs in this game and hope you can banned some player who can use cheat,4,positif,2025-11-01 14:52:44,Adrian Pratama
"perangkat low device sering frame drop saat bermain, bahkan sudah rata kiri pun tetep lag, bosok!",perangkat low device sering frame drop saat bermain bahkan sudah rata kiri pun tetep lag bosok,perangkat low device frame drop bermain kiri tetep lag bosok,1,negatif,2025-11-01 13:44:12,Choirul
"sudah 6tahun gamain pubgm lagi, sekalinya login bingung dengan UserInterface nya. mungkin bisa lebih berteman untuk UserInterface nya",sudah tahun gamain pubgm lagi sekalinya login bingung dengan userinterface nya mungkin bisa lebih berteman untuk userinterface nya,gamain pubgm sekalinya login bingung userinterface berteman userinterface,5,positif,2025-11-01 13:21:48,ilham saifullah
Keren game nya pubg maju jaya!!!,keren game nya pubg maju jaya,keren game pubg maju jaya,5,positif,2025-11-01 12:16:06,Geboy 576
"lumayan juga game nya, hmm, saya suka",lumayan juga game nya hmm saya suka,lumayan game suka,4,positif,2025-11-01 11:05:28,ミツキオロチ
"Tolong kembalikan PUBG secara original seperti tahun 2017, ini game perang bukan game dukun santet dengan banyak magic yang aneh aneh.",tolong kembalikan pubg secara original seperti tahun ini game perang bukan game dukun santet dengan banyak magic yang aneh aneh,tolong kembalikan pubg original game perang game dukun santet magic aneh aneh,3,netral,2025-11-01 10:05:30,De Hunter's
"event biasa aja, perangkat saya support 120hz tapi ko settingan nya cuma 60fps, tolong di tingkatkan lagi.",event biasa aja perangkat saya support hz tapi ko settingan nya cuma fps tolong di tingkatkan lagi,event perangkat support hz ko settingan fps tolong tingkatkan,4,positif,2025-11-01 06:12:17,Putraa Dharmawan
akun dri s1 kna baned smpe 10 thn kira2 dong lu klo ngeban ajg,akun dri s kna baned smpe thn kira dong lu klo ngeban ajg,akun dri kna baned smpe thn ngeban ajg,1,negatif,2025-11-01 05:22:38,Anya Fernanda
butut burik,butut burik,butut burik,1,negatif,2025-11-01 04:54:17,Salman Alfariji
bayak banget mau di donlot riben kasian sama orang2gak ada tour siyal blum maen udah bayak mau di donlot,bayak banget mau di donlot riben kasian sama oranggak ada tour siyal blum maen udah bayak mau di donlot,bayak donlot riben kasian oranggak tour siyal blum maen bayak donlot,3,netral,2025-11-01 04:47:48,Way Balak
"FIX YOUR BUG!!!, banyak sekali cheater berkeliaran, entah bagaimana tiba2 jadi mayat, tidak ada step/suara tembakan dan teleportasi. Yang kedua adalah force close pada saat war. aku udah coba di 3 device. bukan masalah spesifikasi tapi emang cheater. Dari Ipad, Android, emulator kucoba semua. tetep force close. kalo bisa ban device/email atau apapun itulah. Muak kali aku sama cheater ini.",fix your bug banyak sekali cheater berkeliaran entah bagaimana tiba jadi mayat tidak ada stepsuara tembakan dan teleportasi yang kedua adalah force close pada saat war aku udah coba di device bukan masalah spesifikasi tapi emang cheater dari ipad android emulator kucoba semua tetep force close kalo bisa ban deviceemail atau apapun itulah muak kali aku sama cheater ini,fix your bug cheater berkeliaran mayat stepsuara tembakan teleportasi force close war coba device spesifikasi cheater ipad android emulator kucoba tetep force close ban deviceemail apapun muak kali cheater,1,negatif,2025-11-01 04:31:03,Uss
tolong dong developer sistem nandain musuh sama nandain barang-barang looting terus kalau posisi kita lagi terdesak lagi butuh bantuan atau apapun itu cukup muncul satu tombol aja yang otomatis muncul di saat saat tertentu jadi nggak kebanyakan tombol dan itu juga berguna kalau kita lagi nggak bisa obrolan suara,tolong dong developer sistem nandain musuh sama nandain barangbarang looting terus kalau posisi kita lagi terdesak lagi butuh bantuan atau apapun itu cukup muncul satu tombol aja yang otomatis muncul di saat saat tertentu jadi nggak kebanyakan tombol dan itu juga berguna kalau kita lagi nggak bisa obrolan suara,tolong developer sistem nandain musuh nandain barangbarang looting posisi terdesak butuh bantuan apapun muncul tombol otomatis muncul kebanyakan tombol berguna obrolan suara,5,positif,2025-11-01 02:39:27,Ipan Andrean
halo dev tolong dong saya masih mau main game ini Hem chipset saya jelek si mediatek Helio g100 doang bisa ngak di optimalkan lagi buat pengguna hp kentang kaya saya di lobby oke si 60 fps stabil tapi masuk event nah fps nya stabil di 50 an tapi suka delay layarnya kalo di pencet bisa ngak atau emng hp saya yang kentang banget ya😭,halo dev tolong dong saya masih mau main game ini hem chipset saya jelek si mediatek helio g doang bisa ngak di optimalkan lagi buat pengguna hp kentang kaya saya di lobby oke si fps stabil tapi masuk event nah fps nya stabil di an tapi suka delay layarnya kalo di pencet bisa ngak atau emng hp saya yang kentang banget ya,halo dev tolong main game hem chipset jelek mediatek helio doang ngak optimalkan pengguna hp kentang kaya lobby oke fps stabil masuk event fps stabil an suka delay layarnya pencet ngak emng hp kentang,5,positif,2025-11-01 00:08:55,TEGAR ADI DAYA
give punishment to those who are offline during the game. this is driving me crazy,give punishment to those who are offline during the game this is driving me crazy,give punishment to those who are offline during the game this is driving me crazy,1,negatif,2025-10-31 23:49:56,Ramlianor
"Gua sudah 2 hari tidak bisa main karena akun saya tidak bisa login karena tidak bisa menerima kode verifikasi, padahal no masih aktif dan baru ganti iphone/hp terpaksa bikin akun baru dahlahh, akun utama bermasalah nggak tau kenapa tolong buat dev nya bantu saya males banget bikin baru lagi , gua bisa kasih bintang 1, tapi ini game tervaforit untuk sekarng ini",gua sudah hari tidak bisa main karena akun saya tidak bisa login karena tidak bisa menerima kode verifikasi padahal no masih aktif dan baru ganti iphonehp terpaksa bikin akun baru dahlahh akun utama bermasalah nggak tau kenapa tolong buat dev nya bantu saya males banget bikin baru lagi gua bisa kasih bintang tapi ini game tervaforit untuk sekarng ini,gua main akun login menerima kode verifikasi no aktif ganti iphonehp terpaksa bikin akun dahlahh akun utama bermasalah tolong dev bantu males bikin gua kasih bintang game tervaforit sekarng,4,positif,2025-10-31 22:17:21,Peprian Nzz
"mantal, lebih mantap kalau ada event Mamat Gunshop",mantal lebih mantap kalau ada event mamat gunshop,mantal mantap event mamat gunshop,5,positif,2025-10-31 20:57:32,W
game gw di ban gak jelas coi 😶,game gw di ban gak jelas coi,game ban coi,1,negatif,2025-10-31 20:49:59,MARFIN Hot
"Gilak ni pubg makin hari makin berat,depeloper🥰 tolong dong buat game nya agk nurun dikit kayak pubg lite soal nya makin lama makin lag.dsn juga fps nya makin nurun tolong dong depeloper samain kayak PUBG lite yg ringan.saya tau kalau ya mau kayak PUBG lite pasti ada yg harus di kurangi seperti skin pakaian senjata.gakpapa kok yg penting jangan sering ubdate tar makin tinggi.depeloper dengar gak sih😤 tar aku ngambek ni ah.aku mau main aja GK tenang selalu Pi dah karna fps nurun muluk.plis.....",gilak ni pubg makin hari makin beratdepeloper tolong dong buat game nya agk nurun dikit kayak pubg lite soal nya makin lama makin lagdsn juga fps nya makin nurun tolong dong depeloper samain kayak pubg lite yg ringansaya tau kalau ya mau kayak pubg lite pasti ada yg harus di kurangi seperti skin pakaian senjatagakpapa kok yg penting jangan sering ubdate tar makin tinggidepeloper dengar gak sih tar aku ngambek ni ahaku mau main aja gk tenang selalu pi dah karna fps nurun mulukplis,gilak ni pubg beratdepeloper tolong game agk nurun dikit kayak pubg lite lagdsn fps nurun tolong depeloper samain kayak pubg lite ringansaya kayak pubg lite kurangi skin pakaian senjatagakpapa ubdate tar tinggidepeloper dengar tar ngambek ni ahaku main tenang pi dah fps nurun mulukplis,5,positif,2025-10-31 20:35:25,Syauqi Syauqi ir
woiii kasih miramar di ur krafton,woiii kasih miramar di ur krafton,woiii kasih miramar ur krafton,1,negatif,2025-10-31 19:52:51,Dhika Givari
"udah bagus cuma TOLONG YAHH PERBAIKI SERVER NYA @TENCEN,GAME SEBAGUS INI MASA IYAH SERVER RUSAK KAN LAWAKK 😌",udah bagus cuma tolong yahh perbaiki server nya game sebagus ini masa iyah server rusak kan lawakk,bagus tolong yahh perbaiki server game sebagus iyah server rusak lawakk,5,positif,2025-10-31 19:46:32,Ardy Joe
ah kenapa ini pubg saya mutar² doank padahal pakai wifi dan buka YouTube atau aplikasi lain lancar,ah kenapa ini pubg saya mutar doank padahal pakai wifi dan buka youtube atau aplikasi lain lancar,pubg mutar doank pakai wifi buka youtube aplikasi lancar,2,negatif,2025-10-31 19:42:51,Badri Badri
Kalau mau kolab pilih2 lah jangan sama konten2 kek bocil gak jelas,kalau mau kolab pilih lah jangan sama konten kek bocil gak jelas,kolab pilih konten kek bocil,3,netral,2025-10-31 19:34:22,Dadang Beracun
Coba di royal pass berikut hadirkan skin M4 yang bisa di upgrade.. dan baju-bajunya di elitin dikitlah jangan gaya kampungan mulu,coba di royal pass berikut hadirkan skin m yang bisa di upgrade dan bajubajunya di elitin dikitlah jangan gaya kampungan mulu,coba royal pass hadirkan skin upgrade bajubajunya elitin dikitlah gaya kampungan mulu,1,negatif,2025-10-31 19:28:28,Rigi Mokoagow
"kenapa semakin naik level rank, semakin rusak step lawan walau sudah kedengaran langkah lawan. kadang stepnya di depan kaget ternyata lawannya di belakang. maksudnya gimana cara game ini? kalau seperti itu lebih baik jangan di tampilkan tanda step lawan kalau tidak sesuai... tolong di perbaiki.",kenapa semakin naik level rank semakin rusak step lawan walau sudah kedengaran langkah lawan kadang stepnya di depan kaget ternyata lawannya di belakang maksudnya gimana cara game ini kalau seperti itu lebih baik jangan di tampilkan tanda step lawan kalau tidak sesuai tolong di perbaiki,level rank rusak step lawan kedengaran langkah lawan kadang stepnya kaget lawannya maksudnya game tampilkan tanda step lawan sesuai tolong perbaiki,4,positif,2025-10-31 19:01:08,Alam Terbuka
bagussssss,bagussssss,bagussssss,5,positif,2025-10-31 18:54:34,Bima Naufal Fahreza
mantap ggwp,mantap ggwp,mantap ggwp,5,positif,2025-10-31 18:36:07,Nicodemus Triadi Bertam
Rusak ini Game banyak Cheat Maps Hack,rusak ini game banyak cheat maps hack,rusak game cheat maps hack,1,negatif,2025-10-31 17:38:34,Fandi Ahmad
PUBG memang game yg bagus tapi saya memohon berikan saya kesempatan untuk bermain karena hp saya ram 2GB,pubg memang game yg bagus tapi saya memohon berikan saya kesempatan untuk bermain karena hp saya ram gb,pubg game bagus memohon kesempatan bermain hp ram gb,1,negatif,2025-10-31 17:19:46,Minok Hasiman
"minimal kalau UR map nya ganti"" lah jangan, kebanyakan erangel terus. setiap main UR map yg muncul erangel terus, tolong lah perbaiki, utamakan ping jga nda stabil setiap ada musuh naik tiba"" ke 200ms, bukan malah internet saya, krna kalau main game sebelah stabil aja tpi kalau main ur jaringan tidak stabil",minimal kalau ur map nya ganti lah jangan kebanyakan erangel terus setiap main ur map yg muncul erangel terus tolong lah perbaiki utamakan ping jga nda stabil setiap ada musuh naik tiba ke ms bukan malah internet saya krna kalau main game sebelah stabil aja tpi kalau main ur jaringan tidak stabil,minimal ur map ganti kebanyakan erangel main ur map muncul erangel tolong perbaiki utamakan ping jga nda stabil musuh ms internet main game sebelah stabil tpi main ur jaringan stabil,2,negatif,2025-10-31 16:40:16,Fahrul Septiadi
gem nya sangat bagus,gem nya sangat bagus,gem bagus,5,positif,2025-10-31 16:32:21,Rehan Alfariji
jadi kyak epep 😂,jadi kyak epep,kyak epep,1,negatif,2025-10-31 15:58:10,Imo
Bagus! Rating 3-1 itu HP Kentang!,bagus rating itu hp kentang,bagus rating hp kentang,5,positif,2025-10-31 14:08:14,Archell Elzio Evanleon Nadeak
🕶️ 🤣gemini serujuga😊 ya hehehe,gemini serujuga ya hehehe,gemini serujuga hehehe,5,positif,2025-10-31 13:56:31,Evi Nurnaedi
game ini sangat seru,game ini sangat seru,game seru,5,positif,2025-10-31 11:19:46,KING REPTIL
gak bisa berak,gak bisa berak,berak,1,negatif,2025-10-31 09:13:02,Dapa
akusuka,akusuka,akusuka,5,positif,2025-10-31 06:33:24,Al Qory
terlalu banyak bot,terlalu banyak bot,bot,3,netral,2025-10-31 06:10:54,My Xiaomi
"seru banget padahal, tp susah cari match",seru banget padahal tp susah cari match,seru susah cari match,3,netral,2025-10-31 01:25:34,Filza
gaca abis banya cuma dapat hikmahnya,gaca abis banya cuma dapat hikmahnya,gaca abis banya hikmahnya,1,negatif,2025-10-30 23:25:30,eqbal
please Rainy mode😭😭😭😭,please rainy mode,please rainy mode,5,positif,2025-10-30 23:22:04,Aditya Saputra Pratama
mantap geamnya sangat sesuai,mantap geamnya sangat sesuai,mantap geamnya sesuai,5,positif,2025-10-30 21:37:35,Rumasukun Sukun
"Game 1jt bug ,game cacat",game jt bug game cacat,game jt bug game cacat,1,negatif,2025-10-30 20:24:44,Dody Putra
game online yang bisa kita lakukan untuk mendapatkan keuntungan yakin semoga bermanfaat.,game online yang bisa kita lakukan untuk mendapatkan keuntungan yakin semoga bermanfaat,game online lakukan keuntungan semoga bermanfaat,4,positif,2025-10-30 19:00:45,Muhammad isa Isa
seru aja hehe (terlalu singkat) jadi gamenya udah bagus banget soal eventnya Halloween susah bagiku,seru aja hehe terlalu singkat jadi gamenya udah bagus banget soal eventnya halloween susah bagiku,seru hehe singkat gamenya bagus eventnya halloween susah bagiku,5,positif,2025-10-30 18:23:12,Affan Hamizan
tidak bisa login lewat fb,tidak bisa login lewat fb,login fb,5,positif,2025-10-30 17:49:15,Dimas Bagong
gem keluar asap,gem keluar asap,gem asap,1,negatif,2025-10-30 17:25:02,Takeshi Kaneshiro
"min pubg lite di update lah ,di urusin juga event"" yg baguss,pliss",min pubg lite di update lah di urusin juga event yg bagusspliss,min pubg lite update urusin event bagusspliss,2,negatif,2025-10-30 17:07:44,Whatsapp Messenger
